{
  "$schema": "../../schemas/extension.schema.json",
  "id": "microsoft.sample-extension",
  "name": "Sample Extension",
  "description": "A sample Command Palette extension to demonstrate the gallery submission format.",
  "publisher": "Microsoft",
  "version": "1.0.0",
  "category": "Developer Tools",
  "tags": ["sample", "demo", "template"],
  "icon": "icon.png",
  "installSource": {
    "type": "github",
    "value": "https://github.com/microsoft/CmdPal-Extensions"
  },
  "homepage": "https://github.com/microsoft/CmdPal-Extensions",
  "license": "MIT"
}
